Bank,Title,Description,Published At
INDUSIND,IIM Calcutta achieves 100% placement with 529 offers,"IIM Placements: This year witnessed a new trend of firms offering role in ‘Founder’s office’. These roles were offered by OLA, IndusInd Bank, Newme, ParkStreet, PoshN, Kofluence among others",2024-02-19T05:24:37Z
INDUSIND,IndusInd Bank revises fixed deposit rates. Check latest FD interest rates here,"IndusInd Bank has revised its interest rates on fixed deposits, offering rates ranging from 3.50% to 7.75% for the general public and 4% to 8.25% for senior citizens",2024-02-07T18:30:00Z
INDUSIND,HDFC gets RBI nod to acquire 9.5% stake in IndusInd Bank,"The Reserve Bank of India (RBI) has approved HDFC Bank's proposal to acquire an up to 9.5% stake in IndusInd Bank.""Pursuant to Regulation 30 of the SEBI Listing",2024-02-06T06:21:00Z
INDUSIND,HDFC Bank Clarifies RBI Approval For IndusInd Stake Is For AMC & Life Insurance Arms,RBI nod for acquiring a stake in IndusInd Bank pertains to investments by HDFC Bank's Asset Management Company and Life Insurance divisions.,2024-02-06T02:42:08Z
INDUSIND,HDFC Bank gets RBI approval to buy up to 9.50 per cent stake in IndusInd Bank,"If HDFC Bank fails to complete the acquisition within the timeframe of one year, the approval will be revoked.",2024-02-06T01:49:25Z
INDUSIND,HDFC Bank Group stocks open in red post RBI's IndusInd Bank stake-buy nod,The RBI has approved HDFC Bank's proposal to acquire aggregate holding of up to 9.50% in the paid-up share capital or voting rights of IndusInd Bank,2024-02-05T18:30:00Z
INDUSIND,RBI approves HDFC Bank Group's plans to acquire 9.50% 'aggregate holding' in IndusInd Bank,"HDFC Bank Group must acquire a major shareholding in IndusInd Bank within one year, and ensure that its aggregate holding does not exceed 9.50 percent at any time.",2024-02-05T18:30:00Z
INDUSIND,Relief for Sebi as SC stays SAT order in Karvy Stock Broking case,"Sebi's plea contested SAT's previous ruling, which had favoured major lenders such as Axis Bank, ICICI Bank, HDFC Bank, IndusInd Bank, and Bajaj Finance.",2024-01-25T18:30:00Z
INDUSIND,"Friday cheer: Sensex hits 71,700 led by Bharti Airtel, ICICI Bank","Airtel, ONGC, ICICI Bank, Axis Bank, Tech Mahindra are the top gainersReliance Industries, RBL Bank, HUL are some of the big earnings being eyed by the street.IndusInd",2024-01-19T05:27:00Z
INDUSIND,"Stocks to Watch: Reliance Industries, Paytm, HUL, HDFC Bank, IndusInd Bank","UltraTech Cement, RBL Bank, Hindustan Zinc, Atul, Central Bank of India, CESC, CreditAccess Grameen, Hatsun Agro Product, HT Media, Sunteck Realty, Tejas Networks, and Websol Energy System are among the companies set to announce their quarterly earnings on 19 January",2024-01-18T18:30:00Z
INDUSIND,IndusInd Bank share price falls over 2% after Q3 results; Time to buy the stock? Here’s what analysts say,"IndusInd Bank reported an in line performance in 3QFY24, led by healthy NII growth and controlled provisions. Healthy provisioning in the MFI portfolio and moderation in overall slippage run-rate will contribute to a further reduction in credit cost, analysts said.",2024-01-18T18:30:00Z
INDUSIND,IndusInd Q3 net profit rises 17 pc on core income growth,Read more about IndusInd Q3 net profit rises 17 pc on core income growth on Devdiscourse,2024-01-18T13:10:35Z
INDUSIND,"Stocks to Watch: IndusInd Bank, Asian Paints, Nazara Tech, LTIMindtree, NHPC","IndusInd Bank, Finolex Industries, Jindal Stainless, Polycab India, Poonawalla Fincorp, Ramkrishna Forgings, Shoppers Stop, South Indian Bank, Sterling and Wilson Renewable Energy, and Tata Communications are among companies that will announce their quarterly earnings on 18 January.",2024-01-17T18:30:00Z
INDUSIND,IndusInd Bank Q3 Result Preview-Loan growth expected to remain Healthy; deposit traction remains to be watched for,"Q3 Result Preview- IndusInd Bank is expected to see stable performance on the back of healthy loan growth. MOFSL estimates NII (Net Interest Income) for IndusInd Bank to rise 17.9% year on year ,while those at Kotak expect IndusInd Bank Net Interest Income to rise 15.2% year on year.",2024-01-17T18:30:00Z
INDUSIND,Q3 results today: IndusInd Bank to Polycab - 22 companies to declare earnings on Thursday,"Q3 results today: 22 companies that are going to declare Q3 results 2024 on Thursday include IndusInd Bank, Polycab India, Tata Communications, Poonawalla Fincorp, Metro Brands, Finolex Industries, Mastek, South Indian Bank, etc",2024-01-17T18:30:00Z
INDUSIND,IndusInd Bank stock gained 23% in less than 5 months; is there more upside left? Here's what brokerages say,"IndusInd Bank: The private sector lender hit its 52-week high of ₹1,694.35 in the previous session, on January 15. With that, it has now rallied over 71 percent from its 52-week low of ₹990.25, hit on February 1, 2023.",2024-01-15T18:30:00Z
INDUSIND,"Sensex, Nifty trade flat after early gains, IT stocks take the lead","Wipro, NTPC, Tech Mahindra, Infosys are among the top gainers.Nestle India, IndusInd Bank, HDFC Bank, Kotak Mahindra Bank are major laggards.In Asian peers,",2024-01-05T05:20:00Z
INDUSIND,IndusInd Bank share price hits new 52-week high as net advances jump 20% YoY in Q3,"For the December quarter, the bank's net advances grew by 20% to ₹3,26,741 crore as compared to net advances of ₹2,72,754 crore in Q3FY23. In the preceding quarter (Q2FY24), the net advances stood at ₹3,15,454 crore.",2024-01-03T18:30:00Z
INDUSIND,"DLF , HDFC Bank, L&T, Hero, Lupin among 17 top picks by Sharekhan for year 2024","Stock Market Today - DLF, HDFC Bank, IndusInd, L&T, Hero Moto, Lupin, Artemis Medicare, Bank of India, Kirloskar Oil Engines, Radico Khaitan, Wonderla Holidays, Subros, CESC, Hindware Home Innovation , Sterling Tools, Strides Pharma, Gujarat Fluorochemicals are 17 picks by Sharekhan for year 2024",2023-12-31T18:30:00Z
INDUSIND,"Tata Motors, Mahindra & Mahindra & others hit 52 week high today ; Do you own any?","Following shares hit their 52 week high today - Tata Motors, Mahindra & Mahindra, Sun Pharmaceutical Industries, Hero Motocorp, Indusind Bank",2023-12-28T18:30:00Z
INDUSIND,‘eSvarna’: IndusInd Bank introduces UPI-enabled credit card on RuPay network. Five things to know,IndusInd Bank eSvarna credit card comes with exclusive perks and rewards,2023-12-26T18:30:00Z
INDUSIND,IndusInd Bank exits Nippon Life India Asset Management; sells shares worth Rs 795 crore,Read more about IndusInd Bank exits Nippon Life India Asset Management; sells shares worth Rs 795 crore on Devdiscourse,2023-12-20T15:53:12Z
INDUSIND,"Nippon Life India Asset Management share price rises almost 9% on large trade deal news, scales 52 week highs",Stock Market Today- Nippon Life India Asset Management share price rises almost 9% on large trade deal news. News flow suggests that IndusInd Bank is likely to divest a 2.86% equity stake in Nippon Life India Asset Management Ltd (Nippon AMC) through block deals.,2023-12-19T18:30:00Z
INDUSIND,"IndusInd Bank’s strong retail book, balanced credit portfolio mix to drive returns, says Emkay Global as it ups target",IndusInd Bank delivered 21% credit growth in Q2FY24 and believes that incremental growth will be guided by its strategy to deliver better RARoC (>2.5%) instead of just chasing growth.,2023-12-18T18:30:00Z
INDUSIND,Stock markets snap record-breaking run on profit-taking; Sensex drops,"Among the Sensex firms, Power Grid, ITC, JSW Steel, ICICI Bank, Tech Mahindra, Infosys, IndusInd Bank and Mahindra & Mahindra were the major laggards.",2023-12-18T12:21:23Z
INDUSIND,Buy or sell: Sumeet Bagadia recommends three stocks to buy on Monday - December 18,"Buy or sell stocks: Sumeet Bagadia has recommended three stocks to buy on Monday — Tech Mahindra, Grasim Industries and IndusInd Bank",2023-12-15T18:30:00Z
INDUSIND,"Stock Market Updates: Sensex Gains Nearly 100 pts, Hits Fresh High; Nifty Near 21K; GMR Airports Up 3%","Sensex Today: ONGC, HCL Tech, Tech M, IndusInd Bank, Kotak Bank and Tata Motors led gains on the Sensex",2023-12-11T03:57:20Z
INDUSIND,"IndusInd To Catholic Syrian, 4 Banks Offering 8 Percent Interest Rate On FDs For Senior Citizens",The elderly citizens can avail up to 7.40 percent return on FD of 444 days in Punjab and Sind Bank.,2023-12-05T04:57:19Z
INDUSIND,"Top gainers and losers today on 22 November, 2023: Bharat Petroleum Corporation, Cipla, Indusind Bank, Hindalco Industries among most active stocks; Check full list here","Top Gainers and Losers Today : The Sensex gained 92.47 points, or 0.14, to settle at 65930.77, while the Nifty gained 28.45 points, or 0.14, to close at 19783.4.",2023-11-21T18:30:00Z
INDUSIND,"IndusInd Bank, Suzlon Energy among nine firms added to MSCI India Index","As many as nine firms, including IndusInd Bank, Suzlon Energy and One 97 Communications, were added to the MSCI India Index, according to an update announced",2023-11-16T05:10:00Z
INDUSIND,"IndusInd Bank, Suzlon Energy among nine firms added to MSCI India Index","Read more about IndusInd Bank, Suzlon Energy among nine firms added to MSCI India Index on Devdiscourse",2023-11-15T12:34:04Z
INDUSIND,Day trading guide for stock market today: Five stocks to buy or sell on Wednesday - 15th November,"Day trading stocks: Market experts have recommended five stocks to buy today — M&M, IndusInd Bank, Coal India, Hindustan Copper and Sun TV",2023-11-14T18:30:00Z
INDUSIND,"Suzlon hits 52-week high, IndusInd Bank, Paytm, Tata Motors DVR shares rally on MSCI Global Standard Index inclusion",Suzlon share price jumped as much as 4.81% to a 52-week high of ₹40.50 apiece on the BSE. The MSCI Global Standard Index inclusion may lead to inflows worth $264 million in Suzlon Energy.,2023-11-14T18:30:00Z
INDUSIND,"Stocks to Watch: IndusInd, Suzlon, ASK Auto, Grasim, Adani Ports, HCL Tech","FIIs continued selling on Monday as domestic market consolidated on lack of investor activity amid the festive season and weak global cues. The investment by DIIs also moderated to ₹830 crore, which was much lesser than the foreign capital outflow on a weaker rupee.",2023-11-14T18:30:00Z
INDUSIND,"MSCI Index Rejig: Paytm, IndusInd Bank, Suzlon among nine stocks included in Standard Index","As per the latest announcement by the global index provider, the other stocks included in MSCI India Index are APL Apollo Tubes, Macrotech Developers, Persistent Systems, Polycab India and Tata Communications.",2023-11-14T18:30:00Z
INDUSIND,"MSCI Index rejig: Nine stocks including IndusInd Bank, Suzlon Energy, Paytm, likely to enter global index; details here","According to Nuvama Alternative & Quantitative Research, the addition of IndusInd Bank, Suzlon Energy, Persistent Systems, APL Apollo, and One97 Communications to the MSCI Global Standard Index could result in inflows of $163 million to $290 million.",2023-11-13T18:30:00Z
INDUSIND,Samvat 2080 starts on a somber note with Nifty down over a 100 points,"Bajaj Finance, Infosys, ICICI Bank were the major laggards.NTPC, IndusInd Bank, Sun Pharma were the top gainers. The 50DMA at 19570 remains a stiff challenge,",2023-11-13T05:03:00Z
INDUSIND,"Nifty, Sensex rebound after two days of fall amid global rally","IndusInd Bank, Tata Steel, Tata Motors were the major gainers in trade.Tech Mahindra and Bajaj Finance were the laggards.The Nifty climbed 144.10 points or",2023-11-02T10:41:48Z
INDUSIND,"Nifty, Sensex in the green after two days of fall as US Fed keeps rates unchanged","IndusInd Bank, Kotak Mahindra Bank, Axis Bank are the main gainers.Tata Steel has emerged as the only laggard.Seoul, Tokyo, Shanghai and Hong Kong are also",2023-11-02T04:55:03Z
INDUSIND,Day trading guide for stock market today: Six stocks to buy or sell on Monday - 30th October,"Day trading stocks: Market experts have recommended six stocks to buy today — Colpal, IndusInd Bank, Aarti Industries, Bata India, Trent and Vijaya Diagnostic Centre",2023-10-29T18:30:00Z
INDUSIND,Day trading guide for stock market today: Five stocks to buy or sell on Thursday - 26th October,"Day trading stocks: Market experts have recommended five buy or sell stocks — Persistent Systems, Tata Consumer, Coal India, DLF and IndusInd Bank November Future",2023-10-25T18:30:00Z
INDUSIND,"Stocks to Buy: Here's why Kotak Bank, IndusInd Bank are a buy","Sell BHEL, buy INDUSINDBANK and KotakBank for potential gains",2023-10-21T18:30:00Z
INDUSIND,"Stocks to Watch: Bajaj Auto, Wipro, ITC, RIL, Dabur, IndusInd, Bandhan Bank, and Others","Stocks to watch: Shares of firms like Bajaj Auto, Wipro, ITC, RIL, Dabur, IndusInd, Bandhan Bank, and others will be in focus on Thursday's trade.",2023-10-19T03:15:59Z
INDUSIND,"Stocks to Watch: Wipro, Bajaj Auto, LTIM, ICICI Lombard, IndusInd Bank","HUL, ITC, Nestle India, Havells, Mphasis, Jindal Stainless, Metro Brands, Coforge, Cyient, PVR Inox, Voltas, Tata Coffee and Ultratech Cement will be among the stocks to watch on Thursday as they will be declaring their quarterly earnings report",2023-10-18T18:30:00Z
INDUSIND,"IndusInd Bank Q2 preview: Expect stable margin, asset quality; revenue, PAT may see healthy YoY growth",IndusInd Bank is likely to announce healthy Q2FY24 earnings with stable margin and asset quality.,2023-10-17T18:30:00Z
