Bank,Title,Description,Date,Open,High,Low,Close,Adj Close,Volume,Title_Sentiment,Description_Sentiment
BankofBaroda,Bank of Baroda recruitment 2021: Vacancies open for 511 HR posts; check bankofbaroda.in for details,"The last date to apply is 29 April. Candidates are advised to check the eligibility criteria, age limit, and other important details on the official website",2021-04-09,73.400002,77.400002,72.900002,74.0,69.757431,57888088.0,0.0,0.2023
BankofBaroda,Apply for 47 agriculture marketing officer posts at bankofbaroda.in,The online registration process for the AMF posts started on 7 January and the last date to submit the applications is 27 January,2022-01-10,88.099998,92.449997,87.699997,92.150002,86.866859,42535778.0,0.0,0.0
BankofBaroda,Bank of Baroda invites applications for 159 manager posts: Check how to apply,Interested candidates can visit the official Bank of Baroda website — bankofbaroda.in/Career — to apply for the vacancies.,2022-03-28,108.949997,112.349998,107.300003,111.949997,105.531685,46409385.0,0.0,0.4019
BankofBaroda,"Apply for Developer, QAE, and other vacancies",Bank of Baroda has begun the online application process for recruitment to various posts of IT professionals. Candidates can apply for the vacancies at bankofbaroda.in,2022-10-20,137.0,141.850006,135.699997,140.699997,136.627106,29793676.0,0.0,0.0
BankofBaroda,last date to register for 53 AVP posts,Bank of Baroda will close the online application process for the Assistant Vice President (AVP) post today. Apply at bankofbaroda.in till 11:59 pm.,2022-10-29,,,,,,,0.0,0.0
